{
  "name": "Vrowser + React",
  "files": {
    "/index.html": "./index.html",
    "/App.css": "./App.css",
    "/App.tsx": "./App.tsx",
    "/index.css": "./index.css",
    "/main.tsx": "./main.tsx",
    "/react.svg": "./react.svg",
    "/vrowser.svg": "./vrowser.svg",
    "/vrwoser-manifest.json": "./vrwoser-manifest.json"
  },
  "nodeModules": {
    "/node_modules/scheduler/package.json": "./../../../../node_modules/.pnpm/react-dom@19.2.4_react@19.2.4/node_modules/scheduler/package.json",
    "/node_modules/scheduler/index.js": "./../../../../node_modules/.pnpm/react-dom@19.2.4_react@19.2.4/node_modules/scheduler/index.js",
    "/node_modules/scheduler/index.native.js": "./../../../../node_modules/.pnpm/react-dom@19.2.4_react@19.2.4/node_modules/scheduler/index.native.js",
    "/node_modules/scheduler/unstable_mock.js": "./../../../../node_modules/.pnpm/react-dom@19.2.4_react@19.2.4/node_modules/scheduler/unstable_mock.js",
    "/node_modules/scheduler/unstable_post_task.js": "./../../../../node_modules/.pnpm/react-dom@19.2.4_react@19.2.4/node_modules/scheduler/unstable_post_task.js",
    "/node_modules/scheduler/cjs/scheduler-unstable_mock.development.js": "./../../../../node_modules/.pnpm/react-dom@19.2.4_react@19.2.4/node_modules/scheduler/cjs/scheduler-unstable_mock.development.js",
    "/node_modules/scheduler/cjs/scheduler-unstable_mock.production.js": "./../../../../node_modules/.pnpm/react-dom@19.2.4_react@19.2.4/node_modules/scheduler/cjs/scheduler-unstable_mock.production.js",
    "/node_modules/scheduler/cjs/scheduler-unstable_post_task.development.js": "./../../../../node_modules/.pnpm/react-dom@19.2.4_react@19.2.4/node_modules/scheduler/cjs/scheduler-unstable_post_task.development.js",
    "/node_modules/scheduler/cjs/scheduler-unstable_post_task.production.js": "./../../../../node_modules/.pnpm/react-dom@19.2.4_react@19.2.4/node_modules/scheduler/cjs/scheduler-unstable_post_task.production.js",
    "/node_modules/scheduler/cjs/scheduler.development.js": "./../../../../node_modules/.pnpm/react-dom@19.2.4_react@19.2.4/node_modules/scheduler/cjs/scheduler.development.js",
    "/node_modules/scheduler/cjs/scheduler.native.development.js": "./../../../../node_modules/.pnpm/react-dom@19.2.4_react@19.2.4/node_modules/scheduler/cjs/scheduler.native.development.js",
    "/node_modules/scheduler/cjs/scheduler.native.production.js": "./../../../../node_modules/.pnpm/react-dom@19.2.4_react@19.2.4/node_modules/scheduler/cjs/scheduler.native.production.js",
    "/node_modules/scheduler/cjs/scheduler.production.js": "./../../../../node_modules/.pnpm/react-dom@19.2.4_react@19.2.4/node_modules/scheduler/cjs/scheduler.production.js",
    "/node_modules/.vrowser-esm/react-dom.js": "./../../node_modules/.vrowser-esm/react-dom.js",
    "/node_modules/.vrowser-esm/react-dom_client.js": "./../../node_modules/.vrowser-esm/react-dom_client.js",
    "/node_modules/.vrowser-esm/react-dom_profiling.js": "./../../node_modules/.vrowser-esm/react-dom_profiling.js",
    "/node_modules/.vrowser-esm/react-dom_server.browser.js": "./../../node_modules/.vrowser-esm/react-dom_server.browser.js",
    "/node_modules/.vrowser-esm/react-dom_server.bun.js": "./../../node_modules/.vrowser-esm/react-dom_server.bun.js",
    "/node_modules/.vrowser-esm/react-dom_server.edge.js": "./../../node_modules/.vrowser-esm/react-dom_server.edge.js",
    "/node_modules/.vrowser-esm/react-dom_server.js": "./../../node_modules/.vrowser-esm/react-dom_server.js",
    "/node_modules/.vrowser-esm/react-dom_server.node.js": "./../../node_modules/.vrowser-esm/react-dom_server.node.js",
    "/node_modules/.vrowser-esm/react-dom_static.browser.js": "./../../node_modules/.vrowser-esm/react-dom_static.browser.js",
    "/node_modules/.vrowser-esm/react-dom_static.edge.js": "./../../node_modules/.vrowser-esm/react-dom_static.edge.js",
    "/node_modules/.vrowser-esm/react-dom_static.js": "./../../node_modules/.vrowser-esm/react-dom_static.js",
    "/node_modules/.vrowser-esm/react-dom_static.node.js": "./../../node_modules/.vrowser-esm/react-dom_static.node.js",
    "/node_modules/.vrowser-esm/react-dom_test-utils.js": "./../../node_modules/.vrowser-esm/react-dom_test-utils.js",
    "/node_modules/.vrowser-esm/react.js": "./../../node_modules/.vrowser-esm/react.js",
    "/node_modules/.vrowser-esm/react_compiler-runtime.js": "./../../node_modules/.vrowser-esm/react_compiler-runtime.js",
    "/node_modules/.vrowser-esm/react_jsx-dev-runtime.js": "./../../node_modules/.vrowser-esm/react_jsx-dev-runtime.js",
    "/node_modules/.vrowser-esm/react_jsx-runtime.js": "./../../node_modules/.vrowser-esm/react_jsx-runtime.js",
    "/node_modules/.vrowser-esm/react-Dor3WIcF.js": "./../../node_modules/.vrowser-esm/react-Dor3WIcF.js",
    "/node_modules/.vrowser-esm/react-dom-Mf2KGQJx.js": "./../../node_modules/.vrowser-esm/react-dom-Mf2KGQJx.js",
    "/node_modules/.vrowser-esm/react-dom-server-legacy.browser.development-C_pTPiVm.js": "./../../node_modules/.vrowser-esm/react-dom-server-legacy.browser.development-C_pTPiVm.js",
    "/node_modules/.vrowser-esm/react-dom-server.browser.development-D5nueYxp.js": "./../../node_modules/.vrowser-esm/react-dom-server.browser.development-D5nueYxp.js",
    "/node_modules/.vrowser-esm/react-dom-server.edge.development-B7hhXIRC.js": "./../../node_modules/.vrowser-esm/react-dom-server.edge.development-B7hhXIRC.js",
    "/node_modules/.vrowser-esm/react-dom-server.node.development-CHxb0iEX.js": "./../../node_modules/.vrowser-esm/react-dom-server.node.development-CHxb0iEX.js",
    "/node_modules/.vrowser-esm/scheduler-BRMIgplY.js": "./../../node_modules/.vrowser-esm/scheduler-BRMIgplY.js",
    "/node_modules/.vrowser-esm/server.browser-CDVnsGqM.js": "./../../node_modules/.vrowser-esm/server.browser-CDVnsGqM.js",
    "/node_modules/.vrowser-esm/static.browser-CBv13O9M.js": "./../../node_modules/.vrowser-esm/static.browser-CBv13O9M.js",
    "/node_modules/react/package.json": "./../../node_modules/.vrowser-esm/react-package.json",
    "/node_modules/react-dom/package.json": "./../../node_modules/.vrowser-esm/react-dom-package.json"
  },
  "activeFile": "/App.tsx"
}
