{
  "name": "Vrowser + React",
  "files": {
    "/index.html": "./app.html",
    "/main.tsx": "./main.tsx",
    "/App.tsx": "./App.tsx",
    "/App.css": "./App.css",
    "/index.css": "./index.css",
    "/react.svg": "./react.svg",
    "/vrowser.svg": "./vrowser.svg"
  },
  "vendor": {
    "/vendor/react.js": "./vendor/react.js",
    "/vendor/react-dom-client.js": "./vendor/react-dom-client.js",
    "/vendor/react-jsx-dev-runtime.js": "./vendor/react-jsx-dev-runtime.js",
    "/vendor/react-shared.js": "./vendor/react-shared.js"
  },
  "activeFile": "/App.tsx"
}
