{
  "name": "Vrowzer + React",
  "files": {
    "/index.html": "./index.html",
    "/App.css": "./App.css",
    "/App.tsx": "./App.tsx",
    "/index.css": "./index.css",
    "/main.tsx": "./main.tsx",
    "/react.svg": "./react.svg",
    "/vrowzer.svg": "./vrowzer.svg"
  },
  "nodeModules": {
    "/node_modules/scheduler/package.json": "./../../../../node_modules/.pnpm/react-dom@19.2.4_react@19.2.4/node_modules/scheduler/package.json",
    "/node_modules/scheduler/index.js": "./../../../../node_modules/.pnpm/react-dom@19.2.4_react@19.2.4/node_modules/scheduler/index.js",
    "/node_modules/scheduler/index.native.js": "./../../../../node_modules/.pnpm/react-dom@19.2.4_react@19.2.4/node_modules/scheduler/index.native.js",
    "/node_modules/scheduler/unstable_mock.js": "./../../../../node_modules/.pnpm/react-dom@19.2.4_react@19.2.4/node_modules/scheduler/unstable_mock.js",
    "/node_modules/scheduler/unstable_post_task.js": "./../../../../node_modules/.pnpm/react-dom@19.2.4_react@19.2.4/node_modules/scheduler/unstable_post_task.js",
    "/node_modules/scheduler/cjs/scheduler-unstable_mock.development.js": "./../../../../node_modules/.pnpm/react-dom@19.2.4_react@19.2.4/node_modules/scheduler/cjs/scheduler-unstable_mock.development.js",
    "/node_modules/scheduler/cjs/scheduler-unstable_mock.production.js": "./../../../../node_modules/.pnpm/react-dom@19.2.4_react@19.2.4/node_modules/scheduler/cjs/scheduler-unstable_mock.production.js",
    "/node_modules/scheduler/cjs/scheduler-unstable_post_task.development.js": "./../../../../node_modules/.pnpm/react-dom@19.2.4_react@19.2.4/node_modules/scheduler/cjs/scheduler-unstable_post_task.development.js",
    "/node_modules/scheduler/cjs/scheduler-unstable_post_task.production.js": "./../../../../node_modules/.pnpm/react-dom@19.2.4_react@19.2.4/node_modules/scheduler/cjs/scheduler-unstable_post_task.production.js",
    "/node_modules/scheduler/cjs/scheduler.development.js": "./../../../../node_modules/.pnpm/react-dom@19.2.4_react@19.2.4/node_modules/scheduler/cjs/scheduler.development.js",
    "/node_modules/scheduler/cjs/scheduler.native.development.js": "./../../../../node_modules/.pnpm/react-dom@19.2.4_react@19.2.4/node_modules/scheduler/cjs/scheduler.native.development.js",
    "/node_modules/scheduler/cjs/scheduler.native.production.js": "./../../../../node_modules/.pnpm/react-dom@19.2.4_react@19.2.4/node_modules/scheduler/cjs/scheduler.native.production.js",
    "/node_modules/scheduler/cjs/scheduler.production.js": "./../../../../node_modules/.pnpm/react-dom@19.2.4_react@19.2.4/node_modules/scheduler/cjs/scheduler.production.js",
    "/node_modules/.vrowzer-esm/react-dom.js": "./../../../../e2e/vite-react/node_modules/.vrowzer-esm/react-dom.js",
    "/node_modules/.vrowzer-esm/react-dom_client.js": "./../../../../e2e/vite-react/node_modules/.vrowzer-esm/react-dom_client.js",
    "/node_modules/.vrowzer-esm/react-dom_profiling.js": "./../../../../e2e/vite-react/node_modules/.vrowzer-esm/react-dom_profiling.js",
    "/node_modules/.vrowzer-esm/react-dom_server.browser.js": "./../../../../e2e/vite-react/node_modules/.vrowzer-esm/react-dom_server.browser.js",
    "/node_modules/.vrowzer-esm/react-dom_server.bun.js": "./../../../../e2e/vite-react/node_modules/.vrowzer-esm/react-dom_server.bun.js",
    "/node_modules/.vrowzer-esm/react-dom_server.edge.js": "./../../../../e2e/vite-react/node_modules/.vrowzer-esm/react-dom_server.edge.js",
    "/node_modules/.vrowzer-esm/react-dom_server.js": "./../../../../e2e/vite-react/node_modules/.vrowzer-esm/react-dom_server.js",
    "/node_modules/.vrowzer-esm/react-dom_server.node.js": "./../../../../e2e/vite-react/node_modules/.vrowzer-esm/react-dom_server.node.js",
    "/node_modules/.vrowzer-esm/react-dom_static.browser.js": "./../../../../e2e/vite-react/node_modules/.vrowzer-esm/react-dom_static.browser.js",
    "/node_modules/.vrowzer-esm/react-dom_static.edge.js": "./../../../../e2e/vite-react/node_modules/.vrowzer-esm/react-dom_static.edge.js",
    "/node_modules/.vrowzer-esm/react-dom_static.js": "./../../../../e2e/vite-react/node_modules/.vrowzer-esm/react-dom_static.js",
    "/node_modules/.vrowzer-esm/react-dom_static.node.js": "./../../../../e2e/vite-react/node_modules/.vrowzer-esm/react-dom_static.node.js",
    "/node_modules/.vrowzer-esm/react-dom_test-utils.js": "./../../../../e2e/vite-react/node_modules/.vrowzer-esm/react-dom_test-utils.js",
    "/node_modules/.vrowzer-esm/react.js": "./../../../../e2e/vite-react/node_modules/.vrowzer-esm/react.js",
    "/node_modules/.vrowzer-esm/react_compiler-runtime.js": "./../../../../e2e/vite-react/node_modules/.vrowzer-esm/react_compiler-runtime.js",
    "/node_modules/.vrowzer-esm/react_jsx-dev-runtime.js": "./../../../../e2e/vite-react/node_modules/.vrowzer-esm/react_jsx-dev-runtime.js",
    "/node_modules/.vrowzer-esm/react_jsx-runtime.js": "./../../../../e2e/vite-react/node_modules/.vrowzer-esm/react_jsx-runtime.js",
    "/node_modules/.vrowzer-esm/react-CkEsQEGl.js": "./../../../../e2e/vite-react/node_modules/.vrowzer-esm/react-CkEsQEGl.js",
    "/node_modules/.vrowzer-esm/react-dom-acqmn-u7.js": "./../../../../e2e/vite-react/node_modules/.vrowzer-esm/react-dom-acqmn-u7.js",
    "/node_modules/.vrowzer-esm/react-dom-server-legacy.browser.development-cTHl4Rt5.js": "./../../../../e2e/vite-react/node_modules/.vrowzer-esm/react-dom-server-legacy.browser.development-cTHl4Rt5.js",
    "/node_modules/.vrowzer-esm/react-dom-server.browser.development-Bv4lS-Lf.js": "./../../../../e2e/vite-react/node_modules/.vrowzer-esm/react-dom-server.browser.development-Bv4lS-Lf.js",
    "/node_modules/.vrowzer-esm/react-dom-server.edge.development-Dgqg8DVQ.js": "./../../../../e2e/vite-react/node_modules/.vrowzer-esm/react-dom-server.edge.development-Dgqg8DVQ.js",
    "/node_modules/.vrowzer-esm/react-dom-server.node.development-BmqadN72.js": "./../../../../e2e/vite-react/node_modules/.vrowzer-esm/react-dom-server.node.development-BmqadN72.js",
    "/node_modules/.vrowzer-esm/scheduler-CgC0ne8m.js": "./../../../../e2e/vite-react/node_modules/.vrowzer-esm/scheduler-CgC0ne8m.js",
    "/node_modules/.vrowzer-esm/server.browser-D3K17vDb.js": "./../../../../e2e/vite-react/node_modules/.vrowzer-esm/server.browser-D3K17vDb.js",
    "/node_modules/.vrowzer-esm/static.browser-B5obStqf.js": "./../../../../e2e/vite-react/node_modules/.vrowzer-esm/static.browser-B5obStqf.js",
    "/node_modules/react/package.json": "./../../../../e2e/vite-react/node_modules/.vrowzer-esm/react-package.json",
    "/node_modules/react-dom/package.json": "./../../../../e2e/vite-react/node_modules/.vrowzer-esm/react-dom-package.json"
  },
  "activeFile": "/App.tsx"
}
