{
  "name": "Vrowser + Svelte",
  "files": {
    "/index.html": "./app.html",
    "/main.ts": "./main.ts",
    "/App.svelte": "./App.svelte",
    "/Counter.svelte": "./Counter.svelte",
    "/app.css": "./app.css",
    "/svelte.svg": "./svelte.svg",
    "/vrowser.svg": "./vrowser.svg"
  },
  "vendor": {
    "/vendor/svelte.js": "./vendor/svelte.js",
    "/vendor/svelte-internal-client.js": "./vendor/svelte-internal-client.js",
    "/vendor/svelte-shared.js": "./vendor/svelte-shared.js"
  },
  "activeFile": "/App.svelte"
}
