{
  "name": "Vrowzer + React",
  "files": {
    "/index.html": "../../packages/play-vrowzer/fixtures/vite-react/index.html",
    "/App.css": "../../packages/play-vrowzer/fixtures/vite-react/App.css",
    "/App.tsx": "../../packages/play-vrowzer/fixtures/vite-react/App.tsx",
    "/index.css": "../../packages/play-vrowzer/fixtures/vite-react/index.css",
    "/main.tsx": "../../packages/play-vrowzer/fixtures/vite-react/main.tsx",
    "/react.svg": "../../packages/play-vrowzer/fixtures/vite-react/react.svg",
    "/vrowzer.svg": "../../packages/play-vrowzer/fixtures/vite-react/vrowzer.svg"
  },
  "nodeModules": {
    "/node_modules/scheduler/package.json": "../../node_modules/.pnpm/react-dom@19.2.4_react@19.2.4/node_modules/scheduler/package.json",
    "/node_modules/scheduler/index.js": "../../node_modules/.pnpm/react-dom@19.2.4_react@19.2.4/node_modules/scheduler/index.js",
    "/node_modules/scheduler/index.native.js": "../../node_modules/.pnpm/react-dom@19.2.4_react@19.2.4/node_modules/scheduler/index.native.js",
    "/node_modules/scheduler/unstable_mock.js": "../../node_modules/.pnpm/react-dom@19.2.4_react@19.2.4/node_modules/scheduler/unstable_mock.js",
    "/node_modules/scheduler/unstable_post_task.js": "../../node_modules/.pnpm/react-dom@19.2.4_react@19.2.4/node_modules/scheduler/unstable_post_task.js",
    "/node_modules/scheduler/cjs/scheduler-unstable_mock.development.js": "../../node_modules/.pnpm/react-dom@19.2.4_react@19.2.4/node_modules/scheduler/cjs/scheduler-unstable_mock.development.js",
    "/node_modules/scheduler/cjs/scheduler-unstable_mock.production.js": "../../node_modules/.pnpm/react-dom@19.2.4_react@19.2.4/node_modules/scheduler/cjs/scheduler-unstable_mock.production.js",
    "/node_modules/scheduler/cjs/scheduler-unstable_post_task.development.js": "../../node_modules/.pnpm/react-dom@19.2.4_react@19.2.4/node_modules/scheduler/cjs/scheduler-unstable_post_task.development.js",
    "/node_modules/scheduler/cjs/scheduler-unstable_post_task.production.js": "../../node_modules/.pnpm/react-dom@19.2.4_react@19.2.4/node_modules/scheduler/cjs/scheduler-unstable_post_task.production.js",
    "/node_modules/scheduler/cjs/scheduler.development.js": "../../node_modules/.pnpm/react-dom@19.2.4_react@19.2.4/node_modules/scheduler/cjs/scheduler.development.js",
    "/node_modules/scheduler/cjs/scheduler.native.development.js": "../../node_modules/.pnpm/react-dom@19.2.4_react@19.2.4/node_modules/scheduler/cjs/scheduler.native.development.js",
    "/node_modules/scheduler/cjs/scheduler.native.production.js": "../../node_modules/.pnpm/react-dom@19.2.4_react@19.2.4/node_modules/scheduler/cjs/scheduler.native.production.js",
    "/node_modules/scheduler/cjs/scheduler.production.js": "../../node_modules/.pnpm/react-dom@19.2.4_react@19.2.4/node_modules/scheduler/cjs/scheduler.production.js",
    "/node_modules/.vrowzer-esm/react-dom.js": "./node_modules/.vrowzer-esm/react-dom.js",
    "/node_modules/.vrowzer-esm/react-dom_client.js": "./node_modules/.vrowzer-esm/react-dom_client.js",
    "/node_modules/.vrowzer-esm/react-dom_profiling.js": "./node_modules/.vrowzer-esm/react-dom_profiling.js",
    "/node_modules/.vrowzer-esm/react-dom_server.browser.js": "./node_modules/.vrowzer-esm/react-dom_server.browser.js",
    "/node_modules/.vrowzer-esm/react-dom_server.bun.js": "./node_modules/.vrowzer-esm/react-dom_server.bun.js",
    "/node_modules/.vrowzer-esm/react-dom_server.edge.js": "./node_modules/.vrowzer-esm/react-dom_server.edge.js",
    "/node_modules/.vrowzer-esm/react-dom_server.js": "./node_modules/.vrowzer-esm/react-dom_server.js",
    "/node_modules/.vrowzer-esm/react-dom_server.node.js": "./node_modules/.vrowzer-esm/react-dom_server.node.js",
    "/node_modules/.vrowzer-esm/react-dom_static.browser.js": "./node_modules/.vrowzer-esm/react-dom_static.browser.js",
    "/node_modules/.vrowzer-esm/react-dom_static.edge.js": "./node_modules/.vrowzer-esm/react-dom_static.edge.js",
    "/node_modules/.vrowzer-esm/react-dom_static.js": "./node_modules/.vrowzer-esm/react-dom_static.js",
    "/node_modules/.vrowzer-esm/react-dom_static.node.js": "./node_modules/.vrowzer-esm/react-dom_static.node.js",
    "/node_modules/.vrowzer-esm/react-dom_test-utils.js": "./node_modules/.vrowzer-esm/react-dom_test-utils.js",
    "/node_modules/.vrowzer-esm/react.js": "./node_modules/.vrowzer-esm/react.js",
    "/node_modules/.vrowzer-esm/react_compiler-runtime.js": "./node_modules/.vrowzer-esm/react_compiler-runtime.js",
    "/node_modules/.vrowzer-esm/react_jsx-dev-runtime.js": "./node_modules/.vrowzer-esm/react_jsx-dev-runtime.js",
    "/node_modules/.vrowzer-esm/react_jsx-runtime.js": "./node_modules/.vrowzer-esm/react_jsx-runtime.js",
    "/node_modules/.vrowzer-esm/react-DhSKkaEg.js": "./node_modules/.vrowzer-esm/react-DhSKkaEg.js",
    "/node_modules/.vrowzer-esm/react-dom-BOQta--I.js": "./node_modules/.vrowzer-esm/react-dom-BOQta--I.js",
    "/node_modules/.vrowzer-esm/react-dom-server-legacy.browser.development-DZxzxKfb.js": "./node_modules/.vrowzer-esm/react-dom-server-legacy.browser.development-DZxzxKfb.js",
    "/node_modules/.vrowzer-esm/react-dom-server.browser.development-_WA5TgkW.js": "./node_modules/.vrowzer-esm/react-dom-server.browser.development-_WA5TgkW.js",
    "/node_modules/.vrowzer-esm/react-dom-server.edge.development-DQ2c9SFM.js": "./node_modules/.vrowzer-esm/react-dom-server.edge.development-DQ2c9SFM.js",
    "/node_modules/.vrowzer-esm/react-dom-server.node.development-B-1Cn3Bm.js": "./node_modules/.vrowzer-esm/react-dom-server.node.development-B-1Cn3Bm.js",
    "/node_modules/.vrowzer-esm/scheduler-Dg_zGRFs.js": "./node_modules/.vrowzer-esm/scheduler-Dg_zGRFs.js",
    "/node_modules/.vrowzer-esm/server.browser-BUNAQNQ9.js": "./node_modules/.vrowzer-esm/server.browser-BUNAQNQ9.js",
    "/node_modules/.vrowzer-esm/static.browser-DoSr2H73.js": "./node_modules/.vrowzer-esm/static.browser-DoSr2H73.js",
    "/node_modules/react/package.json": "./node_modules/.vrowzer-esm/react-package.json",
    "/node_modules/react-dom/package.json": "./node_modules/.vrowzer-esm/react-dom-package.json"
  },
  "activeFile": "/App.tsx"
}
